{
  "$schema": "http://json-schema.org/draft-07/schema#",
  "$id": "https://rocm.docs.amd.com/projects/hipDNN/schemas/uhd.schema.json",
  "title": "hipDNN Universal Heuristic Descriptor",
  "type": "object",
  "additionalProperties": false,
  "patternProperties": {"^(x-|_)": {}},
  "required": ["version", "id", "name", "adapter"],
  "definitions": {
    "uuid": {"type": "string", "pattern": "^[0-9a-fA-F]{8}-[0-9a-fA-F]{4}-[0-9a-fA-F]{4}-[0-9a-fA-F]{4}-[0-9a-fA-F]{12}(?![\\s\\S])"},
    "revision": {"type": "string", "pattern": "^[0-9]{1,9}\\.[0-9]{1,9}(?![\\s\\S])"},
    "dependency": {
      "type": "object",
      "additionalProperties": false,
      "patternProperties": {"^(x-|_)": {}},
      "required": ["id", "revision"],
      "properties": {
        "id": {"$ref": "#/definitions/uuid"},
        "revision": {"$ref": "#/definitions/revision"}
      }
    },
    "slot_name": {
      "description": "RFC 0021 slot name: a lowercase identifier, never the reserved `global`.",
      "type": "string",
      "pattern": "^[a-z][a-z0-9_]*(?![\\s\\S])",
      "not": {"const": "global"}
    },
    "slot_dependency": {
      "type": "object",
      "additionalProperties": false,
      "patternProperties": {"^(x-|_)": {}},
      "required": ["slot", "id", "revision"],
      "properties": {
        "slot": {"$ref": "#/definitions/slot_name"},
        "id": {"$ref": "#/definitions/uuid"},
        "revision": {"$ref": "#/definitions/revision"}
      }
    },
    "sha256": {
      "description": "SHA-256 of the named file: 64 lowercase hexadecimal digits, no prefix.",
      "type": "string",
      "pattern": "^[0-9a-f]{64}(?![\\s\\S])"
    },
    "relative_path": {
      "description": "A portable '/'-separated file inside the descriptor's directory: no root, backslash, colon, NUL or '..' segment; the final segment names a file. Runtime and packer also reject symlinks escaping that directory at admission (not a concurrent filesystem-mutation boundary).",
      "type": "string",
      "minLength": 1,
      "pattern": "^(?!/)(?![\\s\\S]*[\\\\:\\u0000])(?![\\s\\S]*(?:^|/)\\.\\.(?:/|(?![\\s\\S])))(?![\\s\\S]*(?:^|/)(?:\\.|)(?![\\s\\S]))"
    },
    "artifact": {
      "type": "object",
      "additionalProperties": false,
      "patternProperties": {"^(x-|_)": {}},
      "required": ["artifact"],
      "properties": {
        "artifact": {"$ref": "#/definitions/relative_path"},
        "hash": {"$ref": "#/definitions/sha256"}
      }
    }
  },
  "properties": {
    "version": {"enum": ["1.0", "1.1"]},
    "id": {"$ref": "#/definitions/uuid"},
    "name": {"type": "string", "minLength": 1},
    "adapter": {"enum": ["static_order", "native", "table", "tree_data", "onnx", "custom_library"]},
    "provenance": {"description": "Free-form authoring notes; never read by the loader."},
    "features_signature": {
      "type": "array",
      "minItems": 1,
      "items": {
        "oneOf": [
          {"type": "string", "pattern": "^\\$.+"},
          {"type": "object", "minProperties": 1, "maxProperties": 1}
        ]
      }
    },
    "features_hash": {"type": "string", "pattern": "^sha256:[0-9a-f]{16}(?![\\s\\S])"},
    "categorical_encoding": {
      "type": "object",
      "propertyNames": {"pattern": "^\\$"},
      "additionalProperties": {
        "type": "object",
        "minProperties": 1,
        "additionalProperties": {"type": "integer", "minimum": -2147483648, "maximum": 2147483647}
      }
    },
    "trained_against": {
      "description": "`slot` (beside `kmd`, for one slot's ranker) and `kmds` (in place of `kmd`, for a slotted engine's predict_engine model) are RFC 0021 slot provenance and need version 1.1.",
      "type": "object",
      "additionalProperties": false,
      "patternProperties": {"^(x-|_)": {}},
      "anyOf": [
        {"required": ["ued", "kmd", "umd"]},
        {"required": ["ued", "kmds", "umd"]},
        {"required": ["selector_revision"]}
      ],
      "not": {"required": ["kmd", "kmds"]},
      "dependencies": {
        "ued": {"required": ["umd"], "anyOf": [{"required": ["kmd"]}, {"required": ["kmds"]}]},
        "kmd": ["ued", "umd"],
        "kmds": ["ued", "umd"],
        "umd": {"required": ["ued"], "anyOf": [{"required": ["kmd"]}, {"required": ["kmds"]}]},
        "slot": ["kmd"]
      },
      "properties": {
        "ued": {"$ref": "#/definitions/dependency"},
        "kmd": {"$ref": "#/definitions/dependency"},
        "kmds": {
          "type": "array",
          "minItems": 1,
          "items": {"$ref": "#/definitions/slot_dependency"}
        },
        "slot": {"$ref": "#/definitions/slot_name"},
        "umd": {"type": "array", "uniqueItems": true, "items": {"$ref": "#/definitions/dependency"}},
        "selector_revision": {"type": "string", "minLength": 1},
        "feature_semantics_revision": {"type": "integer", "minimum": 1, "maximum": 9223372036854775807}
      }
    },
    "objective": {"enum": ["max", "min"]},
    "score": {
      "type": "object",
      "additionalProperties": false,
      "patternProperties": {"^(x-|_)": {}},
      "properties": {
        "metric": {"enum": ["tflops", "time"]},
        "calibrated": {"type": "boolean"},
        "transform": {"enum": ["identity", "log1p", "log", "exp", "sqrt"]}
      }
    },
    "static_order": {
      "description": "No parameters: static_order ranks by UKD priority, then descriptor id. Declared ordering criteria (`order`) are not implemented and are refused.",
      "type": "object",
      "additionalProperties": false,
      "patternProperties": {"^(x-|_)": {}}
    },
    "native": {
      "type": "object",
      "additionalProperties": false,
      "patternProperties": {"^(x-|_)": {}},
      "required": ["symbol"],
      "properties": {"symbol": {"type": "string", "minLength": 1}}
    },
    "table": {"$ref": "#/definitions/artifact"},
    "tree_data": {"$ref": "#/definitions/artifact"},
    "onnx": {"$ref": "#/definitions/artifact"},
    "custom_library": {
      "type": "object",
      "additionalProperties": false,
      "patternProperties": {"^(x-|_)": {}},
      "required": ["library", "symbol", "hash"],
      "properties": {
        "library": {"$ref": "#/definitions/relative_path"},
        "symbol": {"type": "string", "minLength": 1},
        "hash": {"$ref": "#/definitions/sha256"},
        "config": {"type": "object", "maxProperties": 0}
      }
    }
  },
  "oneOf": [
    {"required": ["static_order"], "properties": {"adapter": {"const": "static_order"}}},
    {"required": ["native"], "properties": {"adapter": {"const": "native"}}},
    {"required": ["table"], "properties": {"adapter": {"const": "table"}}},
    {"required": ["tree_data"], "properties": {"adapter": {"const": "tree_data"}}},
    {"required": ["onnx"], "properties": {"adapter": {"const": "onnx"}}},
    {"required": ["custom_library"], "properties": {"adapter": {"const": "custom_library"}}}
  ],
  "allOf": [
    {"if": {"properties": {"version": {"const": "1.0"}}},
     "then": {"properties": {"trained_against": {"not": {"anyOf": [
       {"required": ["slot"]}, {"required": ["kmds"]}]}}}}},
    {"oneOf": [
      {"required": ["static_order"]}, {"required": ["native"]},
      {"required": ["table"]}, {"required": ["tree_data"]},
      {"required": ["onnx"]}, {"required": ["custom_library"]}
    ]},
    {"if": {"properties": {"adapter": {"enum": ["table", "tree_data", "onnx"]}}},
     "then": {"required": ["features_signature", "features_hash", "trained_against"]}},
    {"if": {"required": ["features_signature"]},
     "then": {"required": ["features_hash", "trained_against"]}},
    {"if": {"required": ["categorical_encoding"]},
     "then": {"required": ["features_signature"]}},
    {"if": {"properties": {"adapter": {"enum": ["native", "table", "tree_data", "onnx", "custom_library"]}}},
     "then": {"required": ["objective"]}},
    {"if": {"required": ["score"],
            "properties": {"score": {"required": ["calibrated"],
                                     "properties": {"calibrated": {"const": true}}}}},
     "then": {"properties": {"score": {"required": ["metric"]}}}},
    {"if": {"required": ["score"],
            "properties": {"score": {"required": ["metric"],
                                     "properties": {"metric": {"const": "tflops"}}}}},
     "then": {"required": ["objective"], "properties": {"objective": {"const": "max"}}}},
    {"if": {"required": ["score"],
            "properties": {"score": {"required": ["metric"],
                                     "properties": {"metric": {"const": "time"}}}}},
     "then": {"required": ["objective"], "properties": {"objective": {"const": "min"}}}}
  ]
}
