{
  "version": "1.0",
  "id": "355d6738-7ed5-4122-95b0-3dcfc6746e26",
  "name": "hipkernel:flydsl_sdpa_cdna_decode (gfx950, 50 contribution(s))",
  "adapter": "tree_data",
  "features_signature": [
    "$device.total_global_mem",
    "$flydsl_sdpa_cdna.causal",
    "$flydsl_sdpa_cdna.diag_offset",
    "$flydsl_sdpa_cdna.scale",
    "$flydsl_sdpa_cdna.stats.uid",
    "$graph.arithmetic_intensity",
    "$graph.flops",
    "$graph.flops_by_type.SdpaAttributes",
    "$graph.logical_bytes",
    "$graph.nodes[0].attn_scale_value",
    "$graph.nodes[0].diagonal_alignment",
    "$graph.nodes[0].flops",
    "$graph.nodes[0].generate_stats",
    "$graph.nodes[0].k.data_type",
    "$graph.nodes[0].k.dims[0]",
    "$graph.nodes[0].k.dims[1]",
    "$graph.nodes[0].k.dims[2]",
    "$graph.nodes[0].k.dims[3]",
    "$graph.nodes[0].k.numel",
    "$graph.nodes[0].k.strides[0]",
    "$graph.nodes[0].k.strides[1]",
    "$graph.nodes[0].k.strides[2]",
    "$graph.nodes[0].o.data_type",
    "$graph.nodes[0].o.dims[0]",
    "$graph.nodes[0].o.dims[1]",
    "$graph.nodes[0].o.dims[2]",
    "$graph.nodes[0].o.dims[3]",
    "$graph.nodes[0].o.numel",
    "$graph.nodes[0].o.strides[0]",
    "$graph.nodes[0].o.strides[1]",
    "$graph.nodes[0].o.strides[2]",
    "$graph.nodes[0].q.data_type",
    "$graph.nodes[0].q.dims[0]",
    "$graph.nodes[0].q.dims[1]",
    "$graph.nodes[0].q.dims[2]",
    "$graph.nodes[0].q.dims[3]",
    "$graph.nodes[0].q.numel",
    "$graph.nodes[0].q.strides[0]",
    "$graph.nodes[0].q.strides[1]",
    "$graph.nodes[0].q.strides[2]",
    "$graph.nodes[0].v.data_type",
    "$graph.nodes[0].v.dims[0]",
    "$graph.nodes[0].v.dims[1]",
    "$graph.nodes[0].v.dims[2]",
    "$graph.nodes[0].v.dims[3]",
    "$graph.nodes[0].v.numel",
    "$graph.nodes[0].v.strides[0]",
    "$graph.nodes[0].v.strides[1]",
    "$graph.nodes[0].v.strides[2]",
    "$graph.tensor_count",
    "$graph.tensors[0].data_type",
    "$graph.tensors[0].dims[0]",
    "$graph.tensors[0].dims[1]",
    "$graph.tensors[0].dims[2]",
    "$graph.tensors[0].dims[3]",
    "$graph.tensors[0].strides[0]",
    "$graph.tensors[0].strides[1]",
    "$graph.tensors[0].strides[2]",
    "$graph.tensors[1].data_type",
    "$graph.tensors[1].dims[0]",
    "$graph.tensors[1].dims[1]",
    "$graph.tensors[1].dims[2]",
    "$graph.tensors[1].dims[3]",
    "$graph.tensors[1].strides[0]",
    "$graph.tensors[1].strides[1]",
    "$graph.tensors[1].strides[2]",
    "$graph.tensors[2].data_type",
    "$graph.tensors[2].dims[0]",
    "$graph.tensors[2].dims[1]",
    "$graph.tensors[2].dims[2]",
    "$graph.tensors[2].dims[3]",
    "$graph.tensors[2].strides[0]",
    "$graph.tensors[2].strides[1]",
    "$graph.tensors[2].strides[2]",
    "$graph.tensors[3].data_type",
    "$graph.tensors[3].dims[0]",
    "$graph.tensors[3].dims[1]",
    "$graph.tensors[3].dims[2]",
    "$graph.tensors[3].dims[3]",
    "$graph.tensors[3].strides[0]",
    "$graph.tensors[3].strides[1]",
    "$graph.tensors[3].strides[2]"
  ],
  "features_hash": "sha256:82d7563b781e5c59",
  "trained_against": {
    "ued": {
      "id": "63ffc720-10c9-55e1-9b3b-78da0f7c4aea",
      "revision": "1.0"
    },
    "kmd": {
      "id": "3ebdeb0d-adbe-50c3-b251-ea4b5710d50f",
      "revision": "1.0"
    },
    "umd": [
      {
        "id": "da99163f-500b-5ef9-97ca-168fa810d7ca",
        "revision": "1.0"
      }
    ],
    "selector_revision": "generic-untuned-v1/2b968a26aacbf532c4bc0e0cfd215dcec8070426e5dbee6d25210d09cf083bb9",
    "feature_semantics_revision": 1
  },
  "objective": "max",
  "score": {
    "metric": "tflops",
    "calibrated": true,
    "transform": "log"
  },
  "tree_data": {
    "artifact": "model.bin",
    "hash": "6a0e5122198deb775054ea78545684375203773c4be357c79d0d7b4ecd4288ce"
  }
}
