{
  "version": "1.0",
  "id": "54c02c7f-c044-4d1e-97e3-66373ecbb3f2",
  "name": "hipkernel:Gfx950AttentionDense throughput (gfx950, 619 graphs)",
  "adapter": "tree_data",
  "features_signature": [
    "$device.cu_count",
    "$device.lds_size",
    "$device.memory_bus_width",
    "$device.memory_clock_rate",
    "$device.multi_processor_count",
    "$device.peak_memory_bandwidth",
    "$device.total_global_mem",
    "$device.warp_size",
    "$gfx950_attention_dense.causal",
    "$gfx950_attention_dense.k.uid",
    "$gfx950_attention_dense.o.uid",
    "$gfx950_attention_dense.q.uid",
    "$gfx950_attention_dense.scale_bits",
    "$gfx950_attention_dense.v.uid",
    "$graph.flops",
    "$graph.node_count",
    "$graph.nodes[0].alibi_mask",
    "$graph.nodes[0].causal_mask",
    "$graph.nodes[0].causal_mask_bottom_right",
    "$graph.nodes[0].compute_data_type",
    "$graph.nodes[0].diagonal_alignment",
    "$graph.nodes[0].flops",
    "$graph.nodes[0].has_attention_mask",
    "$graph.nodes[0].has_variable_lengths",
    "$graph.nodes[0].k.data_type",
    "$graph.nodes[0].k.dims[0]",
    "$graph.nodes[0].k.dims[1]",
    "$graph.nodes[0].k.dims[2]",
    "$graph.nodes[0].k.dims[3]",
    "$graph.nodes[0].k.strides[0]",
    "$graph.nodes[0].k.strides[1]",
    "$graph.nodes[0].k.strides[2]",
    "$graph.nodes[0].k.strides[3]",
    "$graph.nodes[0].o.data_type",
    "$graph.nodes[0].o.dims[0]",
    "$graph.nodes[0].o.dims[1]",
    "$graph.nodes[0].o.dims[2]",
    "$graph.nodes[0].o.dims[3]",
    "$graph.nodes[0].o.strides[0]",
    "$graph.nodes[0].o.strides[1]",
    "$graph.nodes[0].o.strides[2]",
    "$graph.nodes[0].o.strides[3]",
    "$graph.nodes[0].padding_mask",
    "$graph.nodes[0].q.data_type",
    "$graph.nodes[0].q.dims[0]",
    "$graph.nodes[0].q.dims[1]",
    "$graph.nodes[0].q.dims[2]",
    "$graph.nodes[0].q.dims[3]",
    "$graph.nodes[0].q.strides[0]",
    "$graph.nodes[0].q.strides[1]",
    "$graph.nodes[0].q.strides[2]",
    "$graph.nodes[0].q.strides[3]",
    "$graph.nodes[0].type",
    "$graph.nodes[0].v.data_type",
    "$graph.nodes[0].v.dims[0]",
    "$graph.nodes[0].v.dims[1]",
    "$graph.nodes[0].v.dims[2]",
    "$graph.nodes[0].v.dims[3]",
    "$graph.nodes[0].v.strides[0]",
    "$graph.nodes[0].v.strides[1]",
    "$graph.nodes[0].v.strides[2]",
    "$graph.nodes[0].v.strides[3]",
    "$graph.tensor_count",
    "$graph.tensors[0].data_type",
    "$graph.tensors[0].dims[0]",
    "$graph.tensors[0].dims[1]",
    "$graph.tensors[0].dims[2]",
    "$graph.tensors[0].dims[3]",
    "$graph.tensors[0].rank",
    "$graph.tensors[0].strides[0]",
    "$graph.tensors[0].strides[1]",
    "$graph.tensors[0].strides[2]",
    "$graph.tensors[0].strides[3]",
    "$graph.tensors[1].data_type",
    "$graph.tensors[1].dims[0]",
    "$graph.tensors[1].dims[1]",
    "$graph.tensors[1].dims[2]",
    "$graph.tensors[1].dims[3]",
    "$graph.tensors[1].rank",
    "$graph.tensors[1].strides[0]",
    "$graph.tensors[1].strides[1]",
    "$graph.tensors[1].strides[2]",
    "$graph.tensors[1].strides[3]",
    "$graph.tensors[2].data_type",
    "$graph.tensors[2].dims[0]",
    "$graph.tensors[2].dims[1]",
    "$graph.tensors[2].dims[2]",
    "$graph.tensors[2].dims[3]",
    "$graph.tensors[2].rank",
    "$graph.tensors[2].strides[0]",
    "$graph.tensors[2].strides[1]",
    "$graph.tensors[2].strides[2]",
    "$graph.tensors[2].strides[3]",
    "$graph.tensors[3].data_type",
    "$graph.tensors[3].dims[0]",
    "$graph.tensors[3].dims[1]",
    "$graph.tensors[3].dims[2]",
    "$graph.tensors[3].dims[3]",
    "$graph.tensors[3].rank",
    "$graph.tensors[3].strides[0]",
    "$graph.tensors[3].strides[1]",
    "$graph.tensors[3].strides[2]",
    "$graph.tensors[3].strides[3]"
  ],
  "features_hash": "sha256:c6ce334d42c82819",
  "trained_against": {
    "ued": {
      "id": "b87bcbcb-8632-4989-b28a-53f5d35e39c1",
      "revision": "1.0"
    },
    "kmd": {
      "id": "9e461663-31d6-4051-9267-196d2a226c10",
      "revision": "1.0"
    },
    "umd": [
      {
        "id": "2005621f-2558-4346-bd94-c20c695e6bec",
        "revision": "1.0"
      }
    ],
    "selector_revision": "generic-untuned-v1/cd09606b39e1ab63c2269b7353166a40b2f4b84b4a92feffe410695c9817d784"
  },
  "objective": "max",
  "score": {
    "units": "tflops",
    "calibrated": true,
    "transform": "log1p"
  },
  "tree_data": {
    "artifact": "model.bin"
  }
}
