{
  "version": "1.0",
  "id": "011b9a83-7434-499a-a240-852370172d37",
  "name": "Generated UHD",
  "adapter": "tree_data",
  "features_signature": [
    "$gfx1151_wmma_attention.bottom_right",
    "$gfx1151_wmma_attention.lse.uid",
    "$gfx1151_wmma_attention.mask",
    "$gfx1151_wmma_attention.scale_bits",
    "$gfx1151_wmma_attention.window_right",
    "$gfx1151_wmma_attention.write_lse",
    "$graph.arithmetic_intensity",
    "$graph.flops",
    "$graph.flops_by_type.SdpaAttributes",
    "$graph.logical_bytes",
    "$graph.nodes[0].attn_scale_value",
    "$graph.nodes[0].diagonal_alignment",
    "$graph.nodes[0].flops",
    "$graph.nodes[0].generate_stats",
    "$graph.nodes[0].k.data_type",
    "$graph.nodes[0].k.dims[0]",
    "$graph.nodes[0].k.dims[1]",
    "$graph.nodes[0].k.dims[2]",
    "$graph.nodes[0].k.dims[3]",
    "$graph.nodes[0].k.numel",
    "$graph.nodes[0].k.strides[0]",
    "$graph.nodes[0].k.strides[1]",
    "$graph.nodes[0].k.strides[2]",
    "$graph.nodes[0].o.data_type",
    "$graph.nodes[0].o.dims[0]",
    "$graph.nodes[0].o.dims[1]",
    "$graph.nodes[0].o.dims[2]",
    "$graph.nodes[0].o.dims[3]",
    "$graph.nodes[0].o.numel",
    "$graph.nodes[0].o.strides[0]",
    "$graph.nodes[0].o.strides[1]",
    "$graph.nodes[0].o.strides[2]",
    "$graph.nodes[0].q.data_type",
    "$graph.nodes[0].q.dims[0]",
    "$graph.nodes[0].q.dims[1]",
    "$graph.nodes[0].q.dims[2]",
    "$graph.nodes[0].q.dims[3]",
    "$graph.nodes[0].q.numel",
    "$graph.nodes[0].q.strides[0]",
    "$graph.nodes[0].q.strides[1]",
    "$graph.nodes[0].q.strides[2]",
    "$graph.nodes[0].v.data_type",
    "$graph.nodes[0].v.dims[0]",
    "$graph.nodes[0].v.dims[1]",
    "$graph.nodes[0].v.dims[2]",
    "$graph.nodes[0].v.dims[3]",
    "$graph.nodes[0].v.numel",
    "$graph.nodes[0].v.strides[0]",
    "$graph.nodes[0].v.strides[1]",
    "$graph.nodes[0].v.strides[2]",
    "$graph.tensor_count",
    "$graph.tensors[0].data_type",
    "$graph.tensors[0].dims[0]",
    "$graph.tensors[0].dims[1]",
    "$graph.tensors[0].dims[2]",
    "$graph.tensors[0].dims[3]",
    "$graph.tensors[0].strides[0]",
    "$graph.tensors[0].strides[1]",
    "$graph.tensors[0].strides[2]",
    "$graph.tensors[1].data_type",
    "$graph.tensors[1].dims[0]",
    "$graph.tensors[1].dims[1]",
    "$graph.tensors[1].dims[2]",
    "$graph.tensors[1].dims[3]",
    "$graph.tensors[1].strides[0]",
    "$graph.tensors[1].strides[1]",
    "$graph.tensors[1].strides[2]",
    "$graph.tensors[2].data_type",
    "$graph.tensors[2].dims[0]",
    "$graph.tensors[2].dims[1]",
    "$graph.tensors[2].dims[2]",
    "$graph.tensors[2].dims[3]",
    "$graph.tensors[2].strides[0]",
    "$graph.tensors[2].strides[1]",
    "$graph.tensors[2].strides[2]",
    "$graph.tensors[3].data_type",
    "$graph.tensors[3].dims[0]",
    "$graph.tensors[3].dims[1]",
    "$graph.tensors[3].dims[2]",
    "$graph.tensors[3].dims[3]",
    "$graph.tensors[3].strides[0]",
    "$graph.tensors[3].strides[1]",
    "$graph.tensors[3].strides[2]"
  ],
  "features_hash": "sha256:ff2ead9106d205cb",
  "trained_against": {
    "ued": {
      "id": "e4eb0bd2-2325-4326-b51a-50c657784041",
      "revision": "1.0"
    },
    "kmd": {
      "id": "a448d4b8-16ed-4ed8-8a79-c05c4bdb6b9d",
      "revision": "1.0"
    },
    "umd": [
      {
        "id": "7a3c6052-d7d1-4abf-804c-5ee33faca795",
        "revision": "1.0"
      }
    ],
    "selector_revision": "generic-untuned-v1/d7584b6dfdeb6a3368b3e226959491b17d3ff210503ae604bd9b17bcf858682b",
    "feature_semantics_revision": 1
  },
  "objective": "max",
  "score": {
    "metric": "tflops",
    "calibrated": true,
    "transform": "log"
  },
  "tree_data": {
    "artifact": "model.bin",
    "hash": "c353371f36df5c22fa291497460bd6471d993e113cef530b08e2b5f1593716c8"
  }
}
