{
  "version": "1.0",
  "id": "cf0524ca-b4bd-4db8-a6d5-3e0fc80d3d3d",
  "name": "Generated UHD",
  "adapter": "tree_data",
  "features_signature": [
    "$kernel.atom",
    "$kernel.block_groups",
    "$kernel.block_h",
    "$kernel.block_q",
    "$kernel.block_w",
    "$kernel.block_waves",
    "$kernel.ck",
    "$kernel.direct_variant",
    "$kernel.double_buffer",
    "$kernel.epilogue",
    "$kernel.group_merge",
    "$kernel.iglp",
    "$kernel.kernel_family",
    "$kernel.pipeline",
    "$kernel.swizzle_wgm",
    "$kernel.tile_h",
    "$kernel.tile_k",
    "$kernel.tile_k_out",
    "$kernel.tile_m",
    "$kernel.tile_n",
    "$kernel.tile_w",
    "$kernel.unroll_k",
    "$kernel.unroll_rows",
    "$kernel.vector_size_a",
    "$kernel.vector_size_b",
    "$kernel.vector_size_c",
    "$kernel.warp_m",
    "$kernel.warp_n",
    "$kernel.warp_tile_k",
    "$kernel.warp_tile_m",
    "$kernel.warp_tile_n",
    "$kernel.waves_m",
    "$kernel.waves_n",
    "$kernel.waves_per_eu",
    "$graph.arithmetic_intensity",
    "$graph.flops",
    "$graph.flops_by_type.ConvolutionFwdAttributes",
    "$graph.logical_bytes",
    "$graph.nodes[0].dilation[0]",
    "$graph.nodes[0].dilation[1]",
    "$graph.nodes[0].flops",
    "$graph.nodes[0].post_padding[0]",
    "$graph.nodes[0].post_padding[1]",
    "$graph.nodes[0].pre_padding[0]",
    "$graph.nodes[0].pre_padding[1]",
    "$graph.nodes[0].stride[0]",
    "$graph.nodes[0].stride[1]",
    "$graph.nodes[0].w.data_type",
    "$graph.nodes[0].w.dims[0]",
    "$graph.nodes[0].w.dims[1]",
    "$graph.nodes[0].w.dims[2]",
    "$graph.nodes[0].w.dims[3]",
    "$graph.nodes[0].w.numel",
    "$graph.nodes[0].w.strides[0]",
    "$graph.nodes[0].w.strides[2]",
    "$graph.nodes[0].w.strides[3]",
    "$graph.nodes[0].x.data_type",
    "$graph.nodes[0].x.dims[0]",
    "$graph.nodes[0].x.dims[1]",
    "$graph.nodes[0].x.dims[2]",
    "$graph.nodes[0].x.dims[3]",
    "$graph.nodes[0].x.numel",
    "$graph.nodes[0].x.strides[0]",
    "$graph.nodes[0].x.strides[2]",
    "$graph.nodes[0].x.strides[3]",
    "$graph.nodes[0].y.data_type",
    "$graph.nodes[0].y.dims[0]",
    "$graph.nodes[0].y.dims[1]",
    "$graph.nodes[0].y.dims[2]",
    "$graph.nodes[0].y.dims[3]",
    "$graph.nodes[0].y.numel",
    "$graph.nodes[0].y.strides[0]",
    "$graph.nodes[0].y.strides[2]",
    "$graph.nodes[0].y.strides[3]",
    "$graph.tensors[0].data_type",
    "$graph.tensors[0].dims[0]",
    "$graph.tensors[0].dims[1]",
    "$graph.tensors[0].dims[2]",
    "$graph.tensors[0].dims[3]",
    "$graph.tensors[0].strides[0]",
    "$graph.tensors[0].strides[2]",
    "$graph.tensors[0].strides[3]",
    "$graph.tensors[1].data_type",
    "$graph.tensors[1].dims[0]",
    "$graph.tensors[1].dims[1]",
    "$graph.tensors[1].dims[2]",
    "$graph.tensors[1].dims[3]",
    "$graph.tensors[1].strides[0]",
    "$graph.tensors[1].strides[2]",
    "$graph.tensors[1].strides[3]",
    "$graph.tensors[2].data_type",
    "$graph.tensors[2].dims[0]",
    "$graph.tensors[2].dims[1]",
    "$graph.tensors[2].dims[2]",
    "$graph.tensors[2].dims[3]",
    "$graph.tensors[2].strides[0]",
    "$graph.tensors[2].strides[2]",
    "$graph.tensors[2].strides[3]"
  ],
  "features_hash": "sha256:c63c8d8a69d48d15",
  "trained_against": {
    "ued": {
      "id": "80a75418-e58b-4923-a7dd-9742f52fd17f",
      "revision": "1.0"
    },
    "kmd": {
      "id": "b4ffadc0-a9e3-471e-878f-6a6d183469fb",
      "revision": "1.0"
    },
    "umd": [
      {
        "id": "b1c3fc89-8060-4f19-a58f-c9f4dd6dfb3d",
        "revision": "1.0"
      }
    ],
    "feature_semantics_revision": 1
  },
  "objective": "max",
  "score": {
    "metric": "tflops",
    "calibrated": true,
    "transform": "log"
  },
  "tree_data": {
    "artifact": "model.bin",
    "hash": "501314b1452fc42a75a3c0d65b715a3c1c2db7fea91aa0fa2cb3a7dfbed1aa1e"
  },
  "categorical_encoding": {
    "$kernel.atom": {
      "16x16x16": 0,
      "32x32x8": 1,
      "none": 2
    },
    "$kernel.direct_variant": {
      "col": 0,
      "grouped": 1,
      "none": 2,
      "nongrouped": 3,
      "spatial": 4,
      "std": 5,
      "tiled": 6
    },
    "$kernel.epilogue": {
      "cshuffle": 0,
      "default": 1,
      "direct": 2
    },
    "$kernel.pipeline": {
      "compv3": 0,
      "compv4": 1,
      "direct": 2,
      "mem": 3
    }
  }
}
